<?xml version="1.0" encoding="UTF-8"?>
<?xml-stylesheet type="text/xsl" href="PTLS_1988.xsl"?>
<!DOCTYPE PLimprimé SYSTEM "PTLS_1988.dtd">
<PLimprimé>
    <comprare_article class="phonetique-et-ajoute-numero">
        <article compare_avec_PL_1980="modifie">
            <ordonnateur_homographe compare_avec_PL_1980="ajoute_numero">1.</ordonnateur_homographe>
            <zone_d_identification_etymologique>
                <composant_d_adressage>
                    <unite_d_adressage>
                        <item_en_adresse>DRIVER</item_en_adresse>
                    </unite_d_adressage>
                </composant_d_adressage>
                <composant_transcription_phonetique
                    compare_phonetique="modifie_presentation_phonetique">
                    <unite_transcription_phonetique>
                        <delimitateur_initial>[</delimitateur_initial>
                        <transcription_phonetique>drajvœr</transcription_phonetique>
                        <delimitateur_final>]</delimitateur_final>
                    </unite_transcription_phonetique>
                    <coordination>ou</coordination>
                    <unite_transcription_phonetique_coordonnee>
                        <delimitateur_initial>[</delimitateur_initial>
                        <transcription_phonetique>drivœr</transcription_phonetique>
                        <delimitateur_final>]</delimitateur_final>
                    </unite_transcription_phonetique_coordonnee>
                </composant_transcription_phonetique>
                <composant_de_categorisation>
                    <categorisation>
                        <categorie>n.</categorie>
                        <genre>m.</genre>
                    </categorisation>
                </composant_de_categorisation>
                <composant_d_etymologie compare_etymologie="ajoute_etymologie">
                    <etymologie>
                        <delimitateur_initial>(</delimitateur_initial>
                        <introducteur_etymologie>mot.</introducteur_etymologie>
                        <etymon_langue>angl.</etymon_langue>
                        <delimitateur_final>)</delimitateur_final>
                    </etymologie>
                </composant_d_etymologie>
            </zone_d_identification_etymologique>
            <zone_de_traitement>
                <Bloc_des_traitements_de_item_polylexical>
                    <Unite_traitement_de_item_polylexical>
                        <numero_subdivision compare_avec_PL_1980="modifie_subdivision_sens"
                            >1.</numero_subdivision>
                        <definition>Au golf, club avec lequel on exécute le drive.</definition>
                    </Unite_traitement_de_item_polylexical>
                    <Unite_traitement_de_item_polylexical>
                        <numero_subdivision compare_avec_PL_1980="modifie_subdivision_sens"
                            >2.</numero_subdivision>
                        <definition>Jockey d'un sulky, en trot attelé.</definition>
                    </Unite_traitement_de_item_polylexical>
                </Bloc_des_traitements_de_item_polylexical>
            </zone_de_traitement>
        </article>
        <!--Drive PTLR 1980-->
        <article>
            <zone_d_identification_etymologique>
                <composant_d_adressage>
                    <unite_d_adressage>
                        <item_en_adresse>DRIVER</item_en_adresse>
                    </unite_d_adressage>
                </composant_d_adressage>
                <composant_transcription_phonetique
                    compare_phonetique="modifie_presentation_phonetique">
                    <unite_transcription_phonetique>
                        <delimitateur_initial>[</delimitateur_initial>
                        <transcription_phonetique>drajvœr</transcription_phonetique>
                        <coordination>ou</coordination>
                        <transcription_phonetique>drajvœr</transcription_phonetique>
                        <delimitateur_final>]</delimitateur_final>
                    </unite_transcription_phonetique>
                </composant_transcription_phonetique>
                <composant_de_categorisation>
                    <categorisation>
                        <categorie>n.</categorie>
                        <genre>m.</genre>
                    </categorisation>
                </composant_de_categorisation>
            </zone_d_identification_etymologique>
            <zone_de_traitement>
                <Bloc_des_traitements_de_item_polylexical>
                    <Unite_traitement_de_item_polylexical>
                        <definition>Au golf, club avec lequel on exécute le drive.</definition>
                    </Unite_traitement_de_item_polylexical>
                    <Unite_traitement_de_item_polylexical>
                        <subdivition_double_barre>||</subdivition_double_barre>
                        <definition>Jockey d'un sulky, en trot attelé.</definition>
                    </Unite_traitement_de_item_polylexical>
                </Bloc_des_traitements_de_item_polylexical>
            </zone_de_traitement>
        </article>
    </comprare_article>
    <comprare_article class="phonetique-et-ajoute-numero">
        <article compare_avec_PL_1980="modifie">
            <ordonnateur_homographe compare_avec_PL_1980="ajoute_numero">2.</ordonnateur_homographe>
            <zone_d_identification_etymologique>
                <composant_d_adressage>
                    <unite_d_adressage>
                        <item_en_adresse>DRIVER</item_en_adresse>
                    </unite_d_adressage>
                </composant_d_adressage>
                <composant_transcription_phonetique
                    compare_phonetique="modifie_presentation_phonetique">
                    <unite_transcription_phonetique>
                        <delimitateur_initial>[</delimitateur_initial>
                        <transcription_phonetique>drajvœr</transcription_phonetique>
                        <delimitateur_final>]</delimitateur_final>
                    </unite_transcription_phonetique>
                    <coordination>ou</coordination>
                    <unite_transcription_phonetique_coordonnee>
                        <delimitateur_initial>[</delimitateur_initial>
                        <transcription_phonetique>drivœr</transcription_phonetique>
                        <delimitateur_final>]</delimitateur_final>
                    </unite_transcription_phonetique_coordonnee>
                </composant_transcription_phonetique>
                <composant_de_categorisation>
                    <categorisation>
                        <categorie>v.</categorie>
                        <rection>i.</rection>
                    </categorisation>
                </composant_de_categorisation>
            </zone_d_identification_etymologique>
            <zone_de_traitement>
                <Unite_traitement_de_item_monolexical>
                    <definition> Au tennis, au golf, faire un drive.</definition>
                </Unite_traitement_de_item_monolexical>
                <Unite_item_recategorise>
                    <introducteur_recategorise>&#9648;</introducteur_recategorise>
                    <composante_recategorise>
                        <categorisation>
                            <categorie>v.</categorie>
                            <rection>t.</rection>
                        </categorisation>
                    </composante_recategorise>
                </Unite_item_recategorise>
                <Unite_traitement_de_item_monolexical>
                    <definition>Conduire (un sulky), dans une course de trot attelé.</definition>
                </Unite_traitement_de_item_monolexical>
            </zone_de_traitement>
        </article>
        <!--Article DRIVE PTLR 1980-->
        <article compare_avec_PL_1980="modifie">
            <zone_d_identification_etymologique>
                <composant_d_adressage>
                    <unite_d_adressage>
                        <item_en_adresse>DRIVER</item_en_adresse>
                    </unite_d_adressage>
                </composant_d_adressage>
                <composant_transcription_phonetique
                    compare_phonetique="modifie_presentation_phonetique">
                    <unite_transcription_phonetique>
                        <delimitateur_initial>[</delimitateur_initial>
                        <transcription_phonetique>drajve</transcription_phonetique>
                        <coordination>ou</coordination>
                        <transcription_phonetique>drive</transcription_phonetique>
                        <delimitateur_final>]</delimitateur_final>
                    </unite_transcription_phonetique>
                </composant_transcription_phonetique>
                <composant_de_categorisation>
                    <categorisation>
                        <categorie>v.</categorie>
                        <rection>i.</rection>
                    </categorisation>
                </composant_de_categorisation>
            </zone_d_identification_etymologique>
            <zone_de_traitement>
                <Unite_traitement_de_item_monolexical>
                    <definition> Au tennis, au golf, faire un drive.</definition>
                </Unite_traitement_de_item_monolexical>
                <Unite_item_recategorise>
                    <introducteur_recategorise>&#9648;</introducteur_recategorise>
                    <composante_recategorise>
                        <categorisation>
                            <categorie>v.</categorie>
                            <rection>t.</rection>
                        </categorisation>
                    </composante_recategorise>
                </Unite_item_recategorise>
                <Unite_traitement_de_item_monolexical>